tweet	label
marist college auckland cluster closed means five significant clusters remain open cluster considered closed new cases two incubation periods ie days date cases completed isolation	real
reasons disrupted immunization services vary even services offered people either unable access reluctance leave transport interruptions economic hardships restrictions movement fear exposed ppl covid	real
global race covid nine leading vaccine developers pledge uphold scientific standards	real
expect complete end day anyone managed isolation facility period hasnt contacted end day theres dedicated healthline team call please call havent heard end today	real
scientists find parasite white house donaldtrump whitehouse pandemic parasites	fake
daily update published many incomplete reports states today two states missing cutoff time ak ri todays data reflects holiday weekend dip testing reporting k new cases today k new tests deaths corrected	real
people referred test waiting result still following balance tested reasons child part repositioning crew overseas refusing test	real
indiafightscorona similarly indias covid deaths per million population also amongst lowest world secretary india staysafe indiawillwin	real
breaking coronavirus revealed base decision infect level alertness	fake
indiafightscorona states testing highest numbers also reporting gradual decline positivity rate national cumulative positivity rate stands today	real
following article published including liberal politicians continued imply causal link blm protests melbournes covid increase theres still evidence protesters caused increase coronacheck	fake
always get day day go spreadsheet look states daily us daily sheets try keep little fresh	real
weve unfrozen states hospitalization data youll see drop national statistics please read post context number new ones hhs	real
bill gates predicted coronavirus pandemic would kill million people created vaccine eradicate africans	fake
eleven new cases covid reported lagos state pm th april confirmed cases covid reported nigeria discharged deaths takeresponsibility	real
followed staff worked period health staff tested tested negative	real
indiafightscorona health ministry issues sop preventive measures followed conducting examinations contain spread covid india	real
new cases covidnigeria lagos plateau rivers ebonyi abia ogun fct osun katsina kaduna ekiti taraba edo anambra akwa ibom kano confirmed discharged deaths	real
pulmonary disease manifestations covid	real
photos ukrainian hospitals show ready end march accept patients covid	fake
caregivers amp household members wear medical mask room w ill person touch maskface use discard mask leaving room clean theirafterward details	real
points coronavirus tax refunds trump telling republican supporters donaldtrump	fake
game changer covid testing abbott labs working antigen test delivers results minutes binaxnow card amp app provide negative testers datestamped health pass renewed time test	real
coronavirus people england see neighbours flouting new rule six encouraged contact police government	real
breaking benefit initiative launched world health organization specific financial amount euros one suffer difficult financial conditions due corona register via link	fake
india thousand samples tested far labs functional private labs given clearance patients hav	real
nashville man secretly suspects friend covid health nashville coronavirus poker friendship	fake
please convince patients wear masks public via	real
cdcs covid health equity strategy describes support disproportionately affected covid like racial amp ethnic minority groups essential amp frontline workers people living rural areas w substance use disorders	real
lemon juice cures covid	fake
ecmo rescue ventilators arent enough covid patients	real
slow spread virus causes covid us air force basic military training texas used series public health mitigation strategies march april read	real
deaths fell lowest single day total since march day average reminder low numbers reflect actions least month ago	real
water botafogos beach rio de janeiro brazil clear clean quarantine	fake
three stories read evening uk cases hit fourmonth high second day row pm urged take blindingly obvious covid action trump tells senate consider supreme court pick	real
new cases covid gombe lagos kano edo fct nasarawa kaduna oyo abia delta borno plateau niger rivers enugu ogun kebbi ondo anambra imo confirmed discharged deaths	real
years ago published study chloroquine effective covid	fake
sound dribbling basketballs faded sunset basketball nba lebronjames coronavirus	fake
south whole reported new deaths today new high region	real
christine lagarde admits something must done old people living long	fake
india coronavirusupdate indiafightscorona indias covid recovery rate scales peak races past	real
today dedicated covid hospitals across country total beds covid patients india covid covid covid coronaupdates coronavirusindia coronavirusupdates coronavirus	real
covid positive temple priest city jaipur spread coronavirus people smoked pipe	fake
minute viral video woman claims india entered stage covid claims husband employed major news channel information passed dr gyani heads indian covid team asks people stock food medicines baby food one month also cautions people army deployed enforce strict lockdown upcoming days	fake
video shows huge crowd gathered american mall neglecting social distancing current pandemic	fake
diagnostics tests currently evaluation new evidence generated around rapid antigen detection tests could gamechanging covid	real
today million cases covid reported lives lost	real
bidensoetoro funneled illegal millions fauccis nih chinas wuhan institute viralogys coronavirus bioweapon program congress expressly prohibited bidensooetoro working onbidensoetoro ccpamp associates caused present covid bioweapon disaster	fake
president united states america donald trump tested positive covid	fake
image claims asymptomatic carriers novel coronavirus immune spread coronavirus communicate antibodies people	fake
according cdc far year florida deaths covid pneumoniaaverage pneumonia deaths florida time period probably coincidence yeah	fake
daily update published states reported k tests k cases deaths number tests rebounded last three days	real
latest update ministry health seventh day row new cases covid report new zealand total number confirmed cases remains number report world health organization	real
stopthespreadofcorona lockdown corona	fake
covid wiped g masts destroyed	fake
news government coronavirus strategy enters hope sorts phase	fake
new cases covidnigeria lagos fct delta edo ogun katsina bayelsa rivers borno plateau ondo oyo kwara osun enugu nasarawa abia cross river kaduna ekiti confirmed discharged deaths	real
people northeast england able meet others outside household today	real
standard weekend reporting singleday caveats apply deaths fell lowest level since april	real
video showing medical staff turkey saluting citizens	fake
check huge difference makes numbers stateand really need last states dont report negatives report incompletely get board	real
public health job support people sense helplessness dr rachael zacks cdc disease detective whose work covid response helped fuel discussion spreads read story	real
daily update published weve tracked million tests k yesterday another huge testing day clear inflection point note track tests state reports details see	real
high rate daily recoveries positioned india top country globally maximum number recovered cases also pushed recovery rate high	real
covid racial data tracker lets break numbers race ethnicity crucial understanding whats happening pandemic us	real
panel setup home ministry recommends private hospitals delhi lower costs isolation beds treatment intensive care units delhi health minister satyendar jains condition deteriorates hes treated covid covid coronavirusfacts	fake
microchip implant covid vaccine	fake
added guam northern mariana islands puerto rico samoa us virgin islands today	real
flu kills times covid	fake
photo claiming sarscov old virus known since	fake
trump administration zero unfulfilled equipment supply requests state governors	fake
solid update covid data reporting thank	real
rhode island governor issues stay home order amid coronavirus pandemic bans gatherings five people	real
number confirmed cases longer falling region country northeast flat days midwest rising	real
article circulating facebook claims microsoft cofounder bill gates said covid vaccine could kill almost one million people citing interview gave	fake
european patent b vaccine new coronavirus	fake
corona virus new deadly form virus china suffering may come india immediately avoid form cold drinks ice creams koolfee etc type preserved foods milkshake rough ice ice colas milk sweets older hours atleast days today	fake
covid testing touched million tests per day translates tests per million population daily much h	real
blowing hot air hairdryer cure coronavirus	fake
tiktok completely banned united states	fake
californias arriving traveler monitoring covid limited poor quality received traveler data high volume travelers amp asymptomatic transmission read lessons learned	real
updated may million cases covid reported us states report cases find number cases age group	real
staff isolation facility close contact period women stood tested footage period women transited customs immigration auckland airport also reviewed	real
facebook post claims covid test dangerous test nasal swab test enter brain cause lasting damage	fake
india deaths per million population india compared world average deaths per million secretary	real
parents today join cdcs live qampa pm et ask questions importance staying date essential childhood vaccines covid outbreak visit cdcs instagram story	real
coronavirus curfew new restrictions pubs bad controlling virus hospitality expert claims	real
message asking people get homes tonight pm next day government made arrangements spray medicine air order kill novel coronavirus	fake
indiafightscorona major highlights week lakhs patients recovered one highest world crore tests conducted lakh tests conducted last week active cases th total cases secretary india	real
cristiano ronaldo convert hotels coronavirus hospitals	fake
black cats vietnam killed consumed covid cure	fake
unmasked chinese intelligence officer reveals truth biologicalweapon china developed use end hong kong protests backfired true world must come together end biologicalweapons coronavirusoutbreak	fake
news lockdown social distancing isnt necessary really horny insists professor neil ferguson	fake
first night republican national convention heres roundup recent claims republicans covid economy	fake
navi mumbais smt purnima pandeyji secured self family increasing immunity period corona regular use	fake
mental health crisis emerge pandemic public health policy measures help research youre knowledgeable friends family find feeling symptoms	real
coronavirus patientswhose stomach ok given coronil vatithose patientswho stomach problems given ghiyatoriroti stomach become okthen coronilvatiallow meto speak doctorscasualty willbe low	fake
michigan gov gretchen whitmer stripped emergency coronavirus powers state legislature	fake
question ariseswhere tax payers money disappearedwhat duty governmentbureaucracts covid pandemic	fake
coronavirus vaccine ready works hours picture	fake
map showing g antennas italy accompanying claim related coronavirus pandemic	fake
factors favor noninvasive ventilation include stably high oxygen requirements normal mental status ward location care moderate severe covid	real
number tests completed laboratories yesterday brings total number tests completed date still wide testing people cold flulike symptoms part ongoing community testing virus	real
finds steps help slow spread covid may also reduce flu widely practiced report emphasizes flu vaccination remains best protection flu getting flu vaccine important ever covid pandemic	real
post photos claiming covid infected patients italy left street	fake
black man greatest risk death longer covid color skin said	real
delhi health minister satyendar jain said single one thousand markaz found coronavirus positive	fake
five new cases covid reported follows lagos kwara katsina pm th april confirmed cases covid reported nigeria discharged deaths states confirmed cases nigeria	real
indiafightscorona india tests lakh samples day two days row total tests near new peak crore crore tested past weeks staysafe indiawillwin	real
tabloid medias guide coronavirus	fake
people starting enter ers fungal lung infections wearing masks	fake
total number confirmed cases covid number report world health organization yesterday laboratories processed tests covid bringing total number tests completed date	real
put together usa students thank india supply hydroxychloroquin proud moments	fake
covidnigeria update two new labs activated covid testing dna lab private sector lab kaduna maid teaching hospital maiduguri brings number covid testing labs nigeria progress sokoto amp port harcourt	real
also tax covid masks sanitizers ac houseslpg cylindersbriefs r fast usage goods frm idlisdosasmeals star hotels yields revenuethink tanks consider special corona tax goods	fake
presidential drugs donaldtrump america coronavirus medical cure	fake
dr stella immanuel says cure found covid	fake
follow live wetherspoons reveals coronavirus cases pubs since reopening	real
indiafightscorona indias recovery rate soared past ensuring covid patients recovering build achievement statesuts exceeded high national average	real
author chen mingfang daughterinlaw renowned doctor medical professor dong dacheng shared experience recovering covid	fake
ryanair introduce covid priority queue flights	fake
daily update published weve tracked total million tests k yesterday note track tests state reports states report tests details see	real
record compile current hospitalizations states dc variations states count covid patients numbers measure strain hospital system record confirmed suspected covid hospitalizations	real
india discharge criteria severe cases based clinical recovery amp patient tested negative rtpcr resolution symptoms	real
arizonas cases declining although testing also fallen states current hospitalization numbers also unequivocally good still states two highest death tolls saturday today	real
colorado continues stayathome hospitals become overloaded however distancing relaxed potential k hospitalizations overwhelming system april learn	real
factchecking wv democratic partys tweet covid transmission latest west virginia partnership amp	fake
latest cdc covidview report indicates covidlike illnesses starting decline southeast south central south westcoast regions still higher levels compared marchapril	real
states reported new cases	real
good state news washingtons testing capacity seems right data reporting problems also seemed testing legitimately nearly k tests reported though	real
post legitfundcom claimed nigerian vicepresident mr abubakar weeping loss sons life	fake
new cases coronavirus madrid linked two universities club	fake
still always going perfect numbers thats best tell one came right site state document use data entry see site	real
people departing managed isolation must return negative test prior released refuse test require stay another days	real
maximum suppression virus optimal strategy professor devi sridhar explains believes herd immunity appropriate way forward tackling covid get latest restrictions	real
arizonas update catches reporting backlog common tuesday data effect across many states day average often useful watch whats clear states surge swamped local testing capacity week almost quarter tests come back positive	real
indiafightscorona statesuts account deaths last hours due covid maharashtra reported deaths followed karnataka uttar pradesh deaths respectively	real
also important grade testing effort rather comprehensiveness regularity reporting former obviously important latter major impacts public understanding whats happening	real
video showing rows black body bags sprawled floor taken east avenue medical center eamc	fake
months trump administration repeatedly warned threat covid posed nation ignored experts failed take action americans paying price	fake
daily update published states reported k tests k cases deaths number currently hospitalized covid patients continues fall many data issues note thread	real
active cases recent community outbreak imported cases quarantine case investigation people receiving hospital level care covid auckland city hospital middlemore hospital	real
uk reported new coronavirus cases highest daily total four months two days since pandemic began exceeded total	real
reported death toll today people thats line last weeks numbers numbers include probable deaths new york city new york state doesnt record yet	real
indiafightscorona early identification followed prompt isolation effective treatment hospitals leading falling percentage active covid cases india	real
selfisolation since case notified second person travelled back overseas imported case todays cases bring new zealands combined total confirmed probable covid cases	real
new app track infections germany corona warnapp using personal data contacts smartphone order track identify people	fake
help prevent spread covid avoid close contact people sick wash hands often least secon	real
says democratic leaders arent wearing masks social distancing private	fake
tweet pakistani journalist saadia afzaal claiming china developed covid vaccine	fake
indiafightscorona exponential increase tests per million tpm population statesuts performing tests per million national average secretary india staysafe indiawillwin	real
indiafightscorona plasma therapy used years form various virus infections used covid whether helps studied amp studying randomized control trial dg	real
coronacorner questions answered covid	fake
student pondicherry university found home remedy covid accepted world health organization	fake
coronavirus testing kits heading uk found contaminated covid london evening standard	fake
maked progress early covid treated cow dung urine inventing procedures modi set go mars	fake
updated coronavirus clinical reference includes evidence increased risk younger patients obesity	real
number covid deaths cear state brazil fell operation federal police investigate frauds death toll	fake
us sees close coronavirus deaths day via	real
man dying coronavirus spends final day negotiating health insurance provider coronavirus healthcare	fake
goi made efforts ramping testing facilities sustained basis network covid testing labs consists labs govt amp pvt regulations covid treatment private hospital done amp specific stateuts	real
protect covid callin prescriptions ahead time use drivethru windows curbside services mailor	real
week ncdcteam trained military personnel including medical lab engineering amp kitchen staff states osun ogun ekiti ondo kwara edo amp oyo exercise focused demystifying covid amp strengthening surveillance case reporting ipc amp case management	real
many covid treatments may associated adverse skin reactions considered differential diagnosis new report says	real
pm th march confirmed cases death breakdown cases states real time please see currently lagos fct ogun enugu ekiti oyo edo bauchi osun rivers benue kaduna	real
active cases community outbreak imported cases quarantine people linked cluster moved quarantine facility including people tested positive household contacts	real
india indiafightscorona india occupies top position world terms total recoveries lakh rec	real
indiafightscorona credit graded amp collaborative efforts centre statesuts widespread testing enabled lakh tests daily days row lab jan india labs	real
government stick bn covid bill dil fridge	fake
whatsapp forward claims covid vaccine ready announced us president donald trump launched next sunday also claims vaccine discovered us scientists cure covid infected patient within hours whatsapp forward alleged image vaccine also shared	fake
factchecked night rnc trumps actions prevent covid biden school choice defunding police james madison sign declaration independence	fake
tasuku honjo japans nobel prizewinning immunologist says coronavirus natural come bats manufactured china	fake
people covid hospitals today aucklandd city middlemore north shore waitkato people ward icu one middlemore waikato hospitals	real
garlic boosts immunity system	fake
denmark passed new cases covid one day cases	fake
theyre going vaccines think relatively soon	fake
chronic lung disease asthma higher risk getting seriously ill coronavirus learn take steps protect slow spread covid	real
donald trump respond coronavirus pandemic review key moments trump said times factchecked	fake
underlying conditions like diabetes mean greater risk getting transmitting covid within home finds cdc study learn	real
says governors michigan new york nevada issued orders banning prescription hydroxychloroquine patients covid	fake
quotes dr denis mukwege saying resigned congolese coronavirus response team ordered fabricate covid case death numbers	fake
want get team together covidsafe meeting rooms plenty coworking space free wifi coffee conveniently located bicester close train road bus links	fake
indiafightscorona indias covid deaths per million population also amongst lowest world india deaths per million population whereas worlds average stands secretary india staysafe indiawillwin	real
till date nanded district maharashtra reported covid cases active covid cases may refer following link details india covid coronavirus	real
reaney yet masks one thing common one way valve let exhaled air seal facd stopping ingress paint smoke bacteria etc yet cloth mask none supposed stop virus lol give head good wobble mate	fake
uptick completed tests encouraging well need days growth declare plateau us testing	real
worker coronavirus testing centre told sky news working fraction capacity even people complain cannot get test	real
school administrators cdc provided benchmarks help prepare plan respond covid monitor frequently adjust strategies fit changing levels covid community learn	real
debate coronavirus vaccines weeks medscape clinical trend	real
ufc pres dana white said one person one place could anticipated challenges covid would bring president trump said coronavirus snuck us adding unforeseen thing experts disagreed rnc	fake
example page texas see page texas reported new test results today performed cumulative tests prior today	real
senate gop proposing fiveyear shield coronavirus lawsuits	fake
dr uma kumar aiims gave interview shown video coronavirus	fake
big deal picture recently taken wuhan china birth place covid	fake
president trump left planet earth donaldtrump space coronavirus	fake
states continue issues reporting hospitalization data well touch problems later thread least states people hospitalized covid	real
pelosi wuhan china days impeachment hoax failed	fake
nebraska still states releasing race ethnicity information others north dakota amp nevada amp	real
shadow health secretary jonathan ashworth says restrictions dont work course would consider restrictions adds necessary fix testing regime read latest	real
survey covidpositive patients found half could identify contact person covid take steps protect slow spread see	real
post shows dead bodies covid patients lying lnjp hospital delhi india	fake
remember practice every day foodsafety covid put away foods could spoil meats milk amp eggs	real
video muslim leader accidentally shot dead celebratory firing recovered covid pakistan	fake
might happen become longterm unemployed due covid previous experience shows youre work yr fair call say reduces chance finding work qanda factcheck	fake
two new cases covid confirmed nigeria lagos osun cases returning travellers nigeria last days th march confirmed cases covid nigeria discharged death	real
government changing rules around selfisolation move force people stay home coronavirus	real
cardiac mri scans showed big athletes tested positive covid also myocarditis	real
says photo shows exact people two different beaches los angeles county jacksonville fla	fake
indiafightscorona indias covid cases per million population amongst lowest world stands india world secretary india staysafe indiawillwin	real
god coronavirus religion god coronavirus	fake
older adults amp people severe chronic medical conditions like heart lung kidney disease seem higher risk serious covid illness	real
covid coronavirus coronavirusupdate cases total tests india apr reasons good newstb vaccination bcg effecttimely travel restrictions lockdownlets build gain stayhome	fake
chain message circulating various social media communities buenaventura valle del cauca colombia claims citys mayor vctor hugo vidal received first complaint office attorney general poor performance functions sic facing covid lack authority public administration says publication	fake
first coronavirus reinfection reported us though experts say likely rare indicates initial exposure may always result full immunity	real
people charter flight contacted either process tested tested returned negative test	real
vaccine ready minorityfriendly coronavirus satire humour lgbtq diversity blm	fake
yesterday laboratories completed tests testing people managed isolation quarantine routine testing either days stay brings total number tests completed date	real
foreign secretary dominic raab joins morning discuss latest covid restrictions announced prime minister kayburley sky freeview watch live	real
corona virus simple remedy onion pinch salt drink water half hour	fake
pictures man wearing helmet sitting pothole road uttar pradesh targeting uttar pradesh government	fake
