tweet	label
video black bucks crossing road kaziranga national park amid covid lockdown	fake
well think climate change still counts worst federal response national emergency nations history pandemic response surely inept irresponsible tragic	fake
coronavirusupdates indiafightscorona crore samples tested today covid tests per million tpm jumps	real
cdc network tracks covid hospitalization rates shows overall hospitalization rate increasing w rates increasing w age rates ppl highest per people ppl take special precautions prevent covid	real
claim india began screening passengers covidaffected countries single casepm modi fact govt mandated universal screening international flights march cases detected across indian states	fake
success covax facility hinges countries signing also filling key funding gaps research development work support lowerincome economies within facility covid	real
dcgi gives nod bharat biotech conduct phase amp ii human clinical trials develop indigenous vaccine covid	real
breaking trump announced us officially leaving world health organization middle pandemicwho currently coordinating international vaccine drug trials fight covid coronavirus coronavirusupdate	fake
head nhs test trace dido harding says theyve seen doubling number children tested coronavirus since schools returned insists planned sizable increase testing capacity live updates	real
bandhugan using panchagavya based nasal spray corona outbreak since antiviral forms layer around mucus membrane logically reduce chance infection also helped feel energetic	fake
new cases covidnigeria lagos oyo delta ebonyi plateau ondo fct ogun edo imo bayelsa benue gombe kano kaduna osun nasarawa borno katsina anambra confirmed discharged deaths	real
coronavirus dies degrees temperature according unicef	fake
glenmarks fabiflufavipiravir yields positive data phase iii covid triala broad spectrum antiviral medication known selectively block rnadependent rna polymerase rdrp sarscov viral replication phasemg day mg days	fake
general icymi new shows actions helped prevent covid outbreaks overnight camps maine summer	real
hhs distribute billion covid hot spots million already paid	real
guam reported new cases today highest singleday number far territory also reporting testing issues dphss reaching storage capacity specimens dphss said delay test results	real
coronavirus grandparents exempt local lockdown rules childcare reasons	real
indiafightscorona coronavirusupdate india sees unprecedented surge covid recoveries nearly recoveries last hours total number recovered cases nearly lakh	real
whole floor main peruvian hospital infected covid decided close place	fake
news stay alert sort means kind lockdownish much clarifies government	fake
stop enjoy pain next days make tick calendar every day feel urge postpone min throw away packets garbage corona excuse enough visit shops get safety near ones	fake
edmonton calgary ignite old rivalries get coronavirus cases ableg	fake
questions pets health pandemic talk veterinarian concerns still learning virus affect animals learn pets covid	real
daily update published weve tracked million tests less k yesterday note track tests state reports states report tests details see	real
new doctors featured viral video coronavirus pandemic history making unproven conspiratorial bizarre medical claims	fake
looking forward making data widely accessible alongside important context understanding health disparities salute organizations like work hope contribute understanding outbreak	real
absolute terms us done lot testing percapita basis pretty far behind nations importantly varies wildly states chart one data users shows	real
mothers counselled many many benefits breastfeeding newborn babies children substantially outweigh potential risks covid infection	real
according greek journalist covid pandemic since dead count people defrauded private company impose social distancing measures	fake
daily update published states reported k tests k cases deaths	real
video shows monkeys attacking gandhi hospital hyderabad	fake
covid test fraud	fake
new cases covidnigeria lagos osun kaduna oyo fct plateau rivers kano ondo ogun abia gombe imo enugu kwara delta niger borno bauchi nasarawa confirmed discharged deaths	real
myrtle beach south carolina reported new coronavirus cases hours	fake
michigan continues stayathome hospitals become overloaded however distancing relaxed potential k hospitalizations overwhelming system april learn	real
new cases covid lagos kano jigawa yobe fct ogun plateau gombe imo edo kwara borno bauchi nasarawa ondo cases covid nigeria discharged deaths	real
indiafightscorona indias total recoveries cross lakh patients recovered three times active cases recoveries exceed active cases lakh staysafe indiawillwin	real
shands hospital gainesville florida confirmed first case coronavirus	fake
testing reached significant milestone yesterday laboratories completed tests bringing total number tests completed date represents new zealand population	real
people linked community cluster remain auckland quarantine facility includes people tested positive covid household contacts	real
states posted record highs new cases since sunday us states	real
snap analysis relief california tested people knew hour ago said huge state dont know many tests still pending based cas previous reporting could lot	real
grateful level interest rapid covid testing community please note due high demand caused additional seasonal respiratory illnesses current shipping delays inbetween shipments rapid covid testing kits	fake
apologies tweet typos today folks danger tweeting also engaging slack conversations typing documents	real
hillary clintons coughing fits presidential race became source media consternation new evidence arisen may lead us believe patient zero covid early july thread	fake
still debunking misinformation coronavirus hoaxes travel fast numbers causes pandemic need clarification	fake
indiafightscorona india occupies top position world terms total recoveries lakh recovered indias recoveries constitute total global recoveries	real
nyc presumptive deaths causing discrepancy jhu tracker	real
news coronation street characters shown starving death brexit ad campaign uses product placement	fake
yesterday laboratories completed tests bringing total number tests completed date lower testing volumes regularly observed holiday weekends	real
pfizers announces likely know vaccine effective end october pfizer plans begin distribution company looking add diverse vulnerable populations trial	real
india indiafightscorona spite sustained level lakh lakh test day positivity figure come	real
people shouting allahu akbar europe coronavirus outbreak	fake
todays five new cases total number active cases imported cases miq facilities community cases	real
morning honourable minister state director general provided updates regular press briefing covidnigeria th march total confirmed covid cases reported nigeria tested negative amp discharged	real
per mumbai covid dashboard slide samples tested covid th july maharashtra covid covid covid coronaupdates coronavirusindia coronavirusupdates coronavirus	real
death young sri lankan nurse living adelaide australia due covid	fake
multisystem inflammatory syndrome children misc appears associated covid cdc recommends healthcare providers report suspected cases local state territorial health departments see health advisory issued	real
part global investment needed ensure everyone everywhere access tools covid vaccines alone billion needed	real
ncdc nicade activities adapted support covid response via subprojects capacity development ipc training hcws heperotasurveillance supporting implementation amr surveillance amp diagnostic stewardship read	real
grateful additional medical supplies including personal protective equipment provided support covid response activities nigeria one key strategies nigerias response ensure frontline health workers protected	real
notice california major adjustment switching back state data frequently updated sources onetime adjustment discussion context california	real
latest updates ministry health new cases covid report new zealand th consecutive day new cases total number confirmed cases remains number recovered cases unchanged	real
anhembi field hospital paulo brasil empty video allegedly proves	fake
false claims number deaths due covid sri lanka	fake
viral text based image post claiming italy infected mobile phone covers quoting findings research without specifying details name research post advises abandon phone covers	fake
new cases covid lagos fct kaduna sokoto kebbi yobe borno edo bauchi gombe enugu oyo zamfara nasarawa osun ebonyi kwara kano plateau confirmed cases covid nigeria discharged deaths	real
patient take steps reduce risk sepsis follow simple tips protect family sam	real
denmark passed new cases covid one day cases	fake
dogs cleared resume eating single piece spaghetti kiss coronavirus covid	fake
unicef published health advice covid	fake
china bioengineered covid wuhan lab purposefully released domestically quell hk protests allowed travel outside country primary target america called asymmetric warfare lowintensity conflict covid primer colour revolution	fake
ka covid cases spiking india sent needs purchase cycle pimps ie administration	fake
says pandemic occurs exactly every years	fake
russian president vladimir putin released lions tigers across russia devour anyone comes stay home die hard goat	fake
indiafightscorona india records recoveries two days row total recoveries cross lakhs recovered cases exceed active cases lakhs staysafe indiawillwin	real
doctor went uttar pradesh state india screen patients coronavirus attacked stones muslims succumbed injuries	fake
committee engage stakeholders including state governments vaccine manufacturers india news	real
cases news coronavirus maturn city	fake
since onset covidnigeria weve trained health workers infection prevention amp control ipc weve developed online course ipc reduce risk covid transmission health care settings takeresponsibility	real
would jesus wear virus mask	fake
transport sec grant shapps says important dont end position france spain whove seen spike covid cases arrives cabinet meeting ahead pms announcement new national restrictions kayburley	real
new cases covid lagos fct delta oyo borno rivers edo ebonyi anambra gombe nasarawa imo kano sokoto jigawa ogun bauchi kebbi kaduna katsina ondo abia niger cases covid discharged deaths	real
coronavirus numbers behind uks newest covid warnings	real
existence canine coronavirus vaccine casts doubt statements isnt one humans	fake
federal government fired thousand public servants received illegally emergency covid allowance	fake
brazilian army built hospital beds hours	fake
dr samadi believe covid bioengineered	fake
whatever humanly possible protect care homes virus theyre place sanctuary winter health secretary matt hancock announces adult social care infection control fund extended get	real
italian billionaire commits suicide throwing th floor tower entire family wiped coronavirus	fake
news eu threatens expel uk unless parliament reopened	fake
months blood disorder webinar discuss covid associated vte risks considerations preregister join us september pm et	real
new recent press conference president oversold credit due white house falling coronavirus fatality statistic	fake
italian government prohibiting christian masses allows prayers islamic mosques	fake
joe exotic tests positive coronavirus prison	fake
may study proceedings national academy sciences shows talking produce thousands saliva droplets stay air minutes	real
acc till july covid cases sitamarhi district bihar recovered active cases covid covid covid coronaupdates coronavirusindia coronavirusupdates coronavirus covidupdates	real
new cases covidnigeria fct lagos ondo osun plateau rivers enugu nasarawa bayelsa ebonyi ekiti oyo edo abia ogun katsina imo adamawa confirmed discharged deaths	real
five largest known clusters virus united states nursing homes meatpacking plants inside correction institutions	real
first death coronavirus barranquilla columbia	fake
covid numbers better almost countries	fake
nice rapid evidence review fails support use vitamin reduce risk severity covid	real
respect putins daughter among volunteers trials russianvaccine russie	fake
texas report yesterday numbers days theyve also changed method counting deaths comprehensive slower method read complex accounting covid deaths recent blog post	real
jb pritzker using chinese test kits illinoisans company whose gm affiliated wuhan institute virology center covid controversy deemed researchers bioweapons lab	fake
want response covidnigeria reagents tests across lab network however testing capacity grossly underutilised challenging states collect samples right people	real
video shows man spitting inside food packets coronavirus crisis	fake
chinese pet owners killing cats dogs throwing window fear pets spreading coronavirus comes memos issued authorities pet owners get rid animals	fake
northern ireland first minister arlene foster says new restrictions tough country known hospitality says kindness host attend large gatherings moment said adding winner would covid	real
video nairobi governor mike sonko claiming world health organization recommends drinking alcohol help prevent new coronavirus circulating online	fake
photo shows millions people berlin anticoronavirus restriction rally late august	fake
total number active cases managed isolation facilities new zealand	real
sadly historical data adjustments come right pulled numbers tweets nudged deaths pushing day average back heres data like	real
using infrared thermometers forehead check temperature body harm organs head	fake
ok grades back score contains simple components reporting positives reliably nv fails reporting negatives sometimes reporting negatives reliably reporting commercial tests labs report positives	real
number covid cases counted cumulatively increasing indicators used track weekly national trends level illnesses hospitalization rates proportion deaths covid fell prior week	real
final shoutout kansas illinois thus far two states breaking testing race ethnicity	real
hydroxychloroqen memory supplement donaldtrump republicans coronavirus dranthonyfauci hydroxychloroquine	fake
americans confused whether getting coronavirus good bad coronavirus politicalcorrectness covid	fake
news man planning spend lockdown writing novel probably wank early grave	fake
report outbreak idiocy spreading times faster coronavirus coronavirus	fake
video shows health workers turning back protest official car passes supposedly protest minister health spain salvador illa minister equality irene montero gregorio maran hospital	fake
senegal doctors come serum coronavirus	fake
trump said new zealand big surge day reported nine new covid cases dont want said despite tens thousands new daily cases us trumps claim big surge rated false	fake
cristiano ronaldo transform hotels portugal hospitals help fight coronavirus communicated hell pay workers doctors free	fake
viral video interview tierra pura portal disseminated doctor mariana colombres garmendia denounces overregistration numbers people infected killed covid disease argentina says buenos aires government pays doctors institutions alleged purpose extending quarantine	fake
launching covid chatbots english spanish hindi proud announce th l	fake
pakistani dr usman riaz speaks coronavirus death	fake
covid patients often report persistent symptoms mecfs making long covid weeks clinical trend	real
professor chris whitty says uk must take covid seriously next six months theres evidence virus currently milder form one april read	real
ok daily update published states reported k tests todays case count secondhighest data record set yesterday hospitalizations kept moving upward states reported deaths	real
audio whatsapp head cardiology gregorio maran hospital states moment uncontrolled coronavirus infection	fake
among individual states two stand different reasons first new jerseys case total jumped unfortunately report total tests public health lab dont know true denominator positives	real
manir hossain yearold man indias tripura died hospital malaysia due new coronavirus	fake
video shows canadian pms wife talking effects coronavirus	fake
indiafightscorona states uts registered recovery rate national average	real
daily update published states reported k tests k less last thursday todays case count k death toll	real
alberto fernndez coronavirus mortality people	fake
indiafightscorona guidelines covid tests recommended samples per day per tests per day per million population details staysafe indiawillwin	real
chloroquine effective remedy coronavirus	fake
positive test rapidantigentest considered true positive whereas symptomatic individuals testing negative rapid antigen test confirmed realtime pcrtest rule infection	real
said states like maryland begun separate confirmed probable deaths method reporting looks like best path forward allow comprehensive accounting	real
africans glad dont live america coronavirus satire irony	fake
social media posts shared tens thousands times claim white house adviser dr anthony fauci stands alone insisting hydroxychloroquines effectiveness covid unproven italy france spain brazil say works	fake
uk faces another national lockdown short order unless people abide new covid restrictions government adviser warns	real
indiafightscorona indias testing capacity surged l daily tests higher cr total tests conducted across country	real
homeopathic drug arsenicum album prevention coronavirus infection message claims ayush ministry india suggested taking arsenicum album homeopathic medicine three days avoid infecting coronavirus	fake
project began know wed still april expect many monthsand putting together technical organizational resources huge thanks many volunteers institutional home	real
today ncdc accredited laboratories across country total capacity test daily lagos state amp fct support ncdc established several sample collection centers amp national testing strategy reviewed maximize testing	real
news man tweeting alllivesmatter also advocates risking vulnerable people dying covid get economy going	fake
osd maharashtra cm uddhav thackeray breaks press meet referring pathetic handling covid government also heads medical assistance cell	fake
indiafightscorona india registered highest recoveries single day covid patients recovered last hrs indias case fatality rate global average stands today details staysafe	real
new vaccine covid alter persons dna genetically modify humans	fake
high streets across england set benefit million governmentfunded scheme help recover impact covid chief executive historic england duncan wilson breakfast channel watch live	real
clause dutch primary schools allowed vaccinate children without parents consent	fake
yesterday erroneously reported one new case ekiti wrong caused error verification process therefore april confirmed cases discharged deaths ekiti state confirmed cases	real
daily update published weve tracked almost million tests k yesterday note track tests state reports states report tests details see	real
paul manafort released prison home confinement amid coronavirus concerns manafort	fake
indiafightscorona new confirmed cases reported last hours country new cases found concentrated ten statesuts	real
dr zhong nanshan said saline solution kill virus	fake
north carolinas health department telling hospitals decide elective surgeries wont eligible receive protective equipment state	fake
health ministry issues manual surveillance teams containment zones india india	real
communicating prevention messages critical slowing spread covid first step get know partners involved says cdcs maggie silver read communication partnerships supports part covid response	real
total number recovered cases active cases additional deaths one person still hospital person require intensive care yesterday labs processed tests total tests completed	real
update coronavirus covid pandemic could disrupt bed net distributions amp core health services malaria burden could double result distribution longlasting insecticide treated nets essential mitigate risk report	real
indiafightscorona india maintains trend high recoveries new recoveries exceeded new cases th day row recovery rate continues rise crosses staysafe indiawillwin	real
older people amp preexisting medical conditions diabetes amp cancer higher risk complications covid lets takeresponsibility ensuring proper hand hygiene physical distancing wearing mask especially around vulnerable groups	real
people knew coronavirus years information hidden ordinary people authorities waited right time launch virus	fake
continue use preventive actions like washing hands wearing mask clean returning home hurricane sally covid	real
ltc deaths occurred since june even covids risks established facilities struggled obtain rapid testing personal protective equipment one health economist calls federal governments response dismal failure	real
covid test results come week later useless	real
icmr establishes new covid testing facilities launched hon pm labs increase testing capacity reduce turnaroundtime reduce exposure lab personnel	real
deaths yesterdaywere pretty close average april daily deaths lower recent days note saw big dip sunmon last week jumping new plateau	real
india indiafightscorona indias maintains high covid recovery rate total recoveries cross lakh recovered patients	real
case wondering much media controls people america vaccinating cattle coronavirus years yet news tells new gunna kill go buy mask	fake
ncezid pets us tested positive covid mostly contact person covid protect pets	real
today still sure much new hhs guidelines hospital data reporting affect data states report far looks like two states idaho missouri run trouble heres mo hospital assoc say	real
looks us like indiana added list serious outbreaks worth watching states press conference discuss hospitalization situation beginning around	real
news man regrets signing dating site username covid	fake
coronavirus made tackling obesity urgent ever	real
quotes anthony fauci writing reject notion virus well get eventually careless lazy heartless stance	fake
india indiafightscorona india scales new heights covid testing lakh tests conducted last hours	real
already coronavirus heres simple test	fake
centre released guidelines unlock third phase easing restrictions put place curb spread covid come effect august bihar government dispelled rumours statewide lockdown till august coronavirusfacts covid	fake
coronavirus curfews bars pubs among new lockdown restrictions northeast england	real
white house started pushing students return schools fall consulted studies experts get better idea communities safely educate students covid	fake
today karnatakas recoveryrate covid patients india covid covid covid coronaupdates coronavirusindia coronavirusupdates coronavirus covidupdates	real
people recovered confirmed probable cases recovered tests processed yesterday brings total number tests people currently hospital	real
facility critical mechanism joint procurement pooling risk across multiple vaccines whatever vaccine proven safe effective countries within facility able access covid	real
brahmins higher indian caste chopped girls tongue offering god prevent covid infection	fake
new cdc travel notices covid australia brazil canada chile japan israel pakistan thailand turkey avoid nonessential travel areas information	real
cdc covidview report summarizes new data covidlike illness hospitalization rates deaths associated influenza pneumonia covid	real
pandemic fake excuse bill gates depopulate earth	fake
new cases covidnigeria lagos gombe oyo delta ondo plateau ebonyi fct kwara kaduna rivers ogun anambra imo ekiti confirmed discharged deaths	real
johnson amp johnson covid vaccine trial prevented severe illness small group hamsters however promising results hamsters necessarily mean vaccine provide level protection humans read	real
coronavirusupdates indiafightscorona indias total covid recovered cases double active cases india	real
daily corona cases highest world since august today govt transformed corona india recorded another grime milestone overtaking brazilnow indian tax payers urge performance expert ministers carry us frm dis	fake
us surpasses record new cases coronavirus	fake
looking counties right collaboration existing group	real
bit surprising day fewer tests positives expected tuesday k cases reported today substantially brought day average cases getting low levels new england midatlantic states	real
donald trump always put wealthy wellconnected friends first come surprise allow banks backs small business owners middle global pandemic new low even	fake
confidence american public continue embrace covid mitigation techniques face mask social dist	real
calls isolation china due coronavirus	fake
trump hails positive talks covid	fake
approved covid testing labs delhi comprising govt labs amp pvt labs kindly refer following link list labs covid covid covid covid covidindia corona coronavirus coronavirusindia	real
everyone stock essentials milk ration medicines cash india soon going declare national emergency	fake
ancient herbal drink effective remedy novel coronavirus	fake
dettol lysol kill coronavirus	fake
image statement prime minister italy	fake
today districts highest active covid cases gujarat surat ahmedabad vadodara rajkot mehsana covid covid covid coronaupdates coronavirusindia coronavirusupdates coronavirus covidupdates	real
coronavirustruth exclusive china tracking every movement uighur minority find reasons detain leaked document ppl arrested growing beards many children karakaxlist	fake
canada criminalized cv measures requiring masks distancing quarantining vaccines	fake
