tweet	label
indiafightscorona recovered cases times number active cases total active cases recovered cases important point first time active cases reduced last hrs secretary india	real
reported deaths quite lowas sundays mondays recent weeks dataset include probable covid deaths reported new york city new york state weve tracked deaths	real
responsive collaborative effective measures right early identification aggressive testing efficient tracking comprehensive treatment collectively led encouraging outcomes covid	real
covid update india registered recoveries last hours number recovered patients	real
finally terms cases reported last days appropriate follow underway including making sure anyone flight isolation facility tested captured day day routine testing	real
brace corona study found difference key outcomes patients continuing vs stopping medication esccongress	real
three new cases covid confirmed lagos nigeria cases returning travellers contact confirmed case pm nd march confirmed cases covid nigeria discharged deaths	real
imported ns ineffective covid raising risk infection hcps patients	real
official mask combat novel coronavirus released	fake
nearly million people united states according trump white house weve conducted million covid tests abysmaldonald trump needs scale testing needs immediately	fake
guntoting michiganders burn witch protest states coronavirus lockdown	fake
older adults people ages severe chronic medical conditions likely develop serious outcomes including death infected covid see cdc guidance people higher risk serious illness	real
total number confirmed cases covid number report world health organization yesterday laboratories processed tests bringing total number tests completed date	real
hi rules people must seated buffets salad bars allowed alert level food must served individually	real
coronavirus pandemic put emphasis importance science health factchecking	fake
covid update higher number patients getting cured indias total recoveries surpass lakh less	real
freely filtered podcast hosts discuss knowns unknowns covids impact kidney	real
even high daily testing levels daily positivity rate cumulative positivity rate less reflects centreled strategy test track treat effectively implemented statesuts	real
new cases report additional recovered cases total number active cases imported cases miq facilities community cases	real
israel cases coronavirus developed cure	fake
underlying conditions increase risk severe coronavirus least patients	real
man doesnt want cause widespread panic everyone going die death pandemic coronavirus	fake
idea get ahead problem professor global public health dr devi sridhar explains new restrictions introduced stop separate households meeting indoors scotland get new restrictions	real
thyrocare thane lab sealed falsepositive covid testing	fake
russia says vaccine covid safe effective would buck historic trend development normally takes years months heres history vaccine development smallpox sars coronavirusfacts	fake
south africa fifthhighest covid infection rate world	fake
indiafightscorona last lakh recoveries recorded days comparison preceding lakh recoveries recorded days respectively	real
indiafightscorona india continues scale new peaks covid tests lakh samples tested consecutive days despite high testing levels daily positivity rate cumulative positivity rate less staysafe	real
must act oklahoma prevent hospital overload projections indicate stay home order must implemented may th may th latest sooner act lives save learn actnow	real
donald trump would receive million three hotels closed four days republican bill hell right	fake
drinking lots water gargling warm water salt vinegar eliminates coronavirus	fake
chinese court gave permission kill patients infected coronavirus	fake
latest cdc covidview report shows nationally percentage ppl testing positive covid decreased compared last week however four regions parts southeast south central west coast northwest saw slight increases	real
cancer trials interrupted covid revived	real
video muslims violating lockdown conditions old city hyderabad	fake
get tested asked keep track movements using nz covid tracer app need everyone alert levels cases area	real
california finally provided update unclear total test count includes pending thats large number testssecond new yorkand presumably includes commercial test providers	real
indiafightscorona recovery rate reached recovered cases times number active cases top states high active caseload also ones presently reporting high level recoveries staysafe indiawillwin	real
new cases covidnigeria plateau lagos katsina edo fct ondo oyo kwara abia nasarawa kano ekiti kaduna kebbi ogun confirmed discharged deaths	real
california fires camel racing coronavirus tribute world photos sept	fake
real sense oklahoma flattened curve number cases oklahoma declined precipitously	fake
additional significant cluster matamata closed means four significant clusters remain open cluster considered closed new cases two incubation periods ie days date cases completed isolation	real
souths sevenday average new cases per million people dropped july peak west sevenday average back new cases per million people dip earlier month related part cas reporting system problems	real
dr fauci funded risky gainoffunction test sarscovid virus bats wuhan institute virology deemed illegal united statesthe chinese conducting test released coronavirus planet forever fauci arsonistfire fighter	fake
whatsapp message says taht ecuador cure coronavirus already found thanks fact ecuadorian doctors disobeyed global law world health organization autopsies thus would discovered cause disease bacterium remedy antibiotics antiinflammatories anticoagulants	fake
british company launched household cleaner destroys covid seconds follow live coronavirus updates	real
reduced retail activity temporary reduction coin production due covid caused national coin shortage shortage part plan eliminate paper money	fake
pm th march confirmed cases discharged death breakdown cases states real time please see currently lagos fct ogun ekiti oyo edo bauchi osun rivers enugu covidnigeria	real
job world health organisationhelp us fight coronavirus working home experience required sms sending jobwork hours daily mobileand earn dailyclick apply vacancy till st july	fake
internet collapse globally due new coronavirus outbreak	fake
says million chinese converted islam proven coronavirus doesnt affect muslims	fake
entire families fall sick covid delhi chemists talk shortage anti viral medicines like fabiflu difficult get medicines kejriwal asks quarantine home system follow govt exists paper	fake
donald trump said brazil country supreme court hampering national governments ability deal covid also criticized brazilian state governors	fake
filming new fall series walking braindead begins hollywood coronavirus ohio horror thewalkingdead	fake
please fwd contacts india never know may help tata group started good initiative providing free doctors consultation online chats facility started need go doctors safe home link reqest everyone take benefit facility coronavirus fightagainstcoronavirus stayhomestaysafe telugunews journalist sai	fake
civil services examination india cancelled due coronavirus outbreak	fake
heard straight president wants terminate health care millions americans middle global pandemicwe cant let happen	fake
coming tonight head prevention programme amp knowledge management ochu tuesdaylive discuss covidnigeria tune dstv channel join conversation time pm	real
says simpsons predicted coronavirus	fake
breakdown cases states real time please see currently lagos fct ogun ekiti oyo edo bauchi osun total confirmed cases covidnigeria	real
coronavirusupdates indiafightscorona indias average positivity rate stands date statesuts positivity rate less	real
texas warns dreaded chupacabra could carrying coronavirus donaldtrump texas dna lachupacabra	fake
video shows president donald trump saying covid democrats new hoax	fake
want find virus support anyone ensure health well well looked stop spread community none active cases requires hospitallevel care	real
italians arguably died covid actually died due another prexisting condition	fake
regret error announcement new covid cases nigeria yesterday ncdc remains committed ensuring transparency accurate reporting infectious disease cases nigeria	real
cdc reduce covid florida case count	fake
part slow spread covid wear face covering public stay least ft away others avoid large crowds wash hands often cdc joins general saying covidstopswithme	real
yesterday laboratories completed tests brings total number tests completed date	real
help scientists discover whether rinsing nose gargling salt water could help reduce covid symptoms amp reduce transmissionif know adults covid symptoms uk please tell study	fake
messed wrong person corona spitting face newyork islamic jihadi spits metro coach passenger door closes unfortunately low iq jihadi picked wrong person forced train door open thulped jihadi pulp made himfall ground stomped headthis way treat spitting lewd behavior jihadis	fake
news dont need wetherspoons reopen says man barrel warm piss shed	fake
indiafightscorona indias cases per million population amongst lowest world stands india world secretary india staysafe indiawillwin	real
b contact tracing bill controllingtracking population coronavirus	fake
deaths rose new singleday high dataset weekend reporting lags tuesday numbers set new highs date throughout april tues deaths tues deaths tues deaths tues deaths	real
colorful bioengineered bacteria could end fashions obsession toxic dyes future futures futurism futurenow futuretrends business facebook google science education news covid	fake
says president barack obama signed medical appliance tax bill forced companies outsource manufacturing masks gowns gloves ventilaors sic china europe russia avoid tax	fake
covid update covid patients recovered last hours led surge tota	real
photograph former united states president barack obama caption saying taken chinese laboratory wuhan barack obama anthony fauci melinda gates visit virus factory probably check progress coronavirus research	fake
outbreaks slaughter houses due false pcr tests pcr test show positive results coronaviruses cattle vaccines cattle	fake
general covid spread people animals close contact sure take steps keep pet safe	real
want believe essential havent bandwidth add pieces lock sustainable data entry	real
neither free coffee companybranded tchotchkes online medical meetings may virtual tumbleweeds blowing says	real
common feel stress covid pandemic use cdc tips resources take care loved ones mental health minoritymentalhealth mentalhealthawareness	real
cdcs guidelines combat spread covid including social distancing discouraging gatherings mor	real
one thing know private testing going scale thousands tests day quite possibly dwarfing sources soon	real
indiafightscorona new cases concentrated statesuts maharashtra alone followed andhra pradesh amp karnataka amp cases respectively	real
audio stating certain section society surat vendors spreading coronavirus	fake
south dakota state left us issued stay home orders social distancing orders south dakota must act avoid hospital overloads	real
photo claims person doctor died attending many covid patinents hospital muiz buenos aires	fake
new cases covidnigeria lagos fct plateau rivers enugu oyo abia delta edo ebonyi cross river kwara kaduna anambra ogun imo bauchi osun nasarawa kano ekiti confirmed discharged deaths	real
september national forecasts suggest new covid deaths reported week ending october forecasts predict total covid deaths us october learn	real
teravolt registry past treatment may impact risk death patients thoracic malignancies develop covid asco lcsm	real
regular reminder take vitamin pills lot nascent science observed correlations proposed mechanisms suggest covid hardest vitamin deficient whether holds end still need vitamin take pills	fake
coronavirus uk excess deaths could hit peak levels within two months nothing done stop spike cases	real
health officials advise everyone follow random facebook profile coronavirus information coronavirusoutbreak	fake
india indiafightscorona india exponentially scaled testing one january lakhday august	real
assume hospitals increase available beds covid patients approximately per day reach maximum capacity increase current bed capacity	real
amid chaos problems caused covid hope physicians would get break complicated payment reporting programs alas	real
know public health officials unprecedented situation deeply appreciate dedication know putting uptodate covid data difficult weve identified six changes florida could make maximize usefulness data	real
wildland firefighters faqs help prevent infection spread covid among crew californ	real
facebook page shared post announcing united states america grant nigerians free work visa two years	fake
idaho statesman situation idahos statelevel access hospital data recent hospital data entered yesterday though reflects standard lag id data point	real
half year sounding highest alarm declaring covid outbreak public health emergency international concern time january cases outside china deaths	real
four new cases covid reported nigeria osun ogun st march confirmed cases covid reported nigeria deaths	real
mantova hospital italy tests plasma treatment heal covid patients italian government sent carabinieri stop experimentation bill gates	fake
indias main opposition party congress general secretary priyanka gandhi arranged buses take home migrants stuck state uttar pradesh	fake
contact tracing key pandemic continues evolve trying keep pace thats added th indicator contact tracing keep track read	real
indiafightscorona exponential increase daily covid testing country lakh tests done last hours secretary india staysafe indiawillwin	real
inhaling steam boiling sea salt orange peelings minutes prevent coronavirus entering body	fake
makes patients schizophrenia vulnerable coronavirus via	real
uk newspaper says maulana saad tablighi jamaat donated rs crore pms relief fund coronavirus	fake
heres comparison new york rest states territories known lives lost due covid come new york	real
next week even dont symptoms please test youre south west auckland greater health risk get covid tests free testing sites nationwide	real
yesterday watched live stream us pole competitions made abundantly clear pole athletes well covid ive heard enough depressing music last months	fake
india japan tests turn positive among highest world india	real
italy cure coronavirus finally found	fake
barack obama first expresident ever speak successor	fake
cannot solve problems years weeks work hard reduce risk covid infection health care workers frontlines need fundamental change approach infection prevention amp control nigerian hospitals ptfcovid	real
yesterday labs processed tests total number tests completed almost completed last week due high levels testing delays hours processing tests	real
clinical trial outcomes favipiravir management mild moderate covid join webinar using link	fake
coronavirusupdates indias covid recovery rate improves september steady improvement indias covid recovery rate since lockdown initiation march indiafightscorona via india	real
video shows bats main source coronavirus many roofs hubei district	fake
heres regional story less cases reported states northeast	real
daily update published weve tracked total completed tests yesterday thats k largest number yet note track tests state reports states report tests details	real
donald trump refused take serious action combat covid crisis result got hes always wanted us isolated rest world	fake
three additional previously reported cases considered recovered covid total number active cases imported cases miq facilities community cases total number confirmed cases covid	real
daylockdown coronavirus coronaviruspandemic dayslockdown dayschallenge indiafightscorona socialdistance best example	fake
israel found cure vaccine coronavirus	fake
june million covid cases reported us states jurisdictions reporting cases see many cases reported state county	real
average tests per million per day increased second week july first week september per advice countries need conduct tests per day per million population comprehensive surveillance suspect cases	real
day average covid deaths dropped weekend	real
report outbreak idiocy spreading times faster coronavirus coronovirus	fake
today honourable minister convened live press briefing update nigerians ongoing response covid outbreak nigeria th march cases covid recorded nigeria discharged death	real
midday today alert level restrictions social gatherings eased groups people permitted includes events home outside home gatherings like religious services parties weddings tangihanga funerals	real
people reported recovered covid increase yesterday cases today two people receiving hospital level care covid one auckland middlemore hospitals neither icu	real
pakistani doctor osama riazs last message taking last breath	fake
covid outbreak broke china immediately started building laboratory capacity within months activated total labs across country least one per geopolitical zone bring testing closer people	real
devastated stock brokers faces hands clearly taking coronavirus precautions seriouslycoronavirus covid stockmarketcrash	fake
woman committed suicide due coronavirus lockdown	fake
combined total confirmed probable cases remains number recovered cases unchanged one case remains active additional deaths report	real
says president donald trump never downplayed virus	fake
new modelling reportedly shown london two three days behind coronavirus hotspots north west north east	real
cover cough covid spreads respiratory droplets infected person coughs sneezes talks additionally also spread someone showing symptoms take everyday precautions part stop spread	real
news suspended coronavirus	fake
people starting enter ers fungal lung infections wearing masks	fake
man visited albany ny days dying coronavirus	fake
series interviews ads businessman clive palmer said antimalaria drug hydroxychloroquine contributed australias low death rate covid found claim baseless new factcheck auspol coronavirusfacts	fake
steam inhalation kiosk fight wuhancoronavirus	fake
calling every ceo america publicly commit buying back companys stock course next year workers face physical economic consequences coronavirus corporate leaders cannot cede responsibility employees	fake
steam kill virus nose throat eradicate coronavirus	fake
pleased announce inclusion new genexpert labs taraba state ncdc molecular laboratory network taraba state specialist hospital jalingo general hospital takum brings number labs covid testing capacity lab network	real
covid update new confirmed cases related community outbreak auckland imported active cases community managed isolation total number confirmed cases date	real
looking covid risk certain destination check cdcs covid travel recommendations country	real
viral video showcasing emergency treatment covid patient maharashtra indian state video shared names different cities maharashtra	fake
monday september cabinet decide alert level gathering limits increase auckland whether rest country move alert level	real
currently people managed isolation quarantine current effective capacity gives us excess capacity	real
hotels remain closed india till october	fake
cardiac mri scans showed big athletes tested positive covid also myocarditis	real
states seem trouble several showing substantial drops current hospitalizations posting hhs notices reporting hospitalization figures published hope see smoother data next week	real
groups pupils sent home positive test rather someone developing symptoms pm says	real
israeli doctors say dangerous wear masks outside	fake
disregard message beneficiary covid funds account credited ncdc also ncdc sending letters employment amp never request payment return employment offers share verified information	real
one person remains auckland city hospital stable condition ward one significant cluster remains open total number confirmed cases covid number report world health organization	real
limiting gatherings one way slow spread covid physical distancing hard find tips support health loved ones challenging time	real
masks help prevent spread covid widely used public wear mask help pro	real
precovid world traveled across us give media literacy trainings teens teachers schools wou	fake
indiafightscorona follow simple handwashing steps prevent spread covid staysafe indiawillwin india india via	real
president trump claims virus control testing available	fake
mouthwash could help fight covid along bad breath	real
type type diabetes associated much higher risk inhospital death covid	real
airborne main way covid spreads doh update guidelines well	fake
vaccine cures covid three hours released next sunday according president donald trump roche already produced millions vaccines	fake
new cases covidnigeria lagos delta ondo fct edo oyo kaduna enugu katsina imo adamawa ogun osun abia rivers nasarawa bauchi niger kebbi ekiti plateau taraba confirmed discharged deaths	real
news new mary trump book claims donald trump orders interns take daily covid tests	fake
testing covid drug determine emergency use authorization comes late fall via	real
india indiafightscorona recovered cases times number active cases people recovered fa	real
news government urged lift lockdown emerges ed sheeran using time write new album	fake
residents corona california want citys name changed donaldtrump california coronavirus grafitti	fake
qanon theorists touted drinking industrial bleach known mms miracle mineral solution miracle cure covid per wikipedia crazydemocrat says republican ad claiming protects pedophiles aimed qanon followers via	fake
one new zealand receiving hospitallevel care covid yesterday laboratories completed tests bringing total number tests completed date	real
coronavirus four welsh counties face local lockdown worrying rapid rise infections	real
coronavirus pm want another lockdown says second wave inevitable	real
weeks covidview reports early indications levels covid illnesses still low may increasing slightly parts united states hospitalization rates deaths still trending learn	real
yesterday tests processed brings total tests processed overall	real
country recommendation managing acute ischemic stroke covid	real
midst pandemic trump administration chose expend effort attempt disestablish mashpee wampanoag tribes reservation istandwithmashpee indian country	fake
order combat covid need decisive public health response decisive economic response ive laid exactly would president crisis take look	fake
still process connecting people people tested reasons child part repositioning crew currently overseas refusing test people refused testing	real
panic fear might limiting human reasoning fueling hoaxes coronavirus via coronavirusfacts datoscoronavirus	fake
bill gates vatican plan depopulate world coronavirus vaccine	fake
lock exit bump corona cases k present official report also doubt still tested corona cases like germany already v r equivalent france corona cases health infrastructure enough save poor	fake
basically jokowis bet aviganfavipiravir might actually paybacks promising result treating covid patients	fake
india newborn twins named corona covid virus	fake
even uncertainty testing florida elsewhere cases nationwide trended past week deaths however continue climb towards day average	real
bill gates admits covid vaccine might kill nearly million people	fake
says coronavirus causes sudden death syndrome	fake
claimed would press events may would never asked coronavirus press conference transcripts show claim false	fake
walmart amazon kroger target costco reported coronavirus cases news	fake
fennel tea cure coronavirus	fake
according unlockguidelines swimming pools permitted functional however yoga institutes amp gymnasiums allowed function sop issued india covid covid unlock covidupdates	real
coronavirus vaccine team led prof robin shattock given million fast	real
lemon bicarbonate tea green tea treat prevent coronavirus	fake
pope francis covid crisis chance come better via	fake
westvirginia low infection growth rate person infecting less one person total number cases shrinking positive test rate low suggesting widespread testing icu use low suggesting capacity handle new covid infections	real
germany sent china bill billion damages caused economy due coronavirus	fake
study proved chloroquine effective treatment coronaviruses	fake
today announced stamp plan responding new cases covid community ongoing elimination continues strategy dealing covid keep new zealanders safe evidence community transmission date	real
covid bacterium virus	fake
india records new covid cases second consecutive day row delhi cm arvind kejriwal announces plasma bank delhi help critically ill coronavirus patients covid coronavirusfacts	fake
working vaccine manufacturers provide countries join effort timely equitable access vaccines licensed approved doesnt pool risk also means prices kept low possible covid	real
dr anthony fauci known years chloroquine hydroxychloroquine treat current case coronavirus prevent future cases	fake
india azim premji donates crore charity currently field work spread across karnataka uttarakhand rajasthan chhattisgarh puducherry telangana madhya pradesh along work northeastern states india	fake
wearing mask help slow spread covid cdcs dr paige armstrong shows correctly put take mask wearamask keep distance wash hands help slow spread covid learn	real
woman making covid masks panties coronavirus ebay panties coronavirusmasks fleamarkets	fake
new finds many covid infections among healthcare workers appear go undetected likely many people infected virus causes covid mild symptoms learn	real
